content_type,text
proverb,Actions speak louder than words.
proverb,A stitch in time saves nine.
proverb,Better late than never.
proverb,Don’t bite the hand that feeds you.
proverb,A picture is worth a thousand words.
proverb,When in Rome; do as the Romans do.
proverb,The early bird catches the worm.
proverb,Practice makes perfect.
proverb,Don’t put all your eggs in one basket.
proverb,Every cloud has a silver lining.
proverb,Life is what you make it.
proverb,He who laughs last; laughs best.
proverb,It’s not the destination; but the journey that matters.
proverb,A journey of a thousand miles begins with a single step.
proverb,What goes around comes around.
proverb,You can’t please everyone.
proverb,Life is a rollercoaster—hold on tight.
proverb,Time heals all wounds.
proverb,Life isn’t about waiting for the storm to pass; it’s about learning to dance in the rain.
proverb,You reap what you sow.
proverb,Hard work never goes unrewarded.
proverb,No pain; no gain.
proverb,Many hands make light work.
proverb,Don’t count your chickens before they hatch.
proverb,You can’t make an omelet without breaking a few eggs.
proverb,Where there’s a will; there’s a way.
proverb,Rome wasn’t built in a day.
proverb,Slow and steady wins the race.
proverb,If you want something done right; do it yourself.
proverb,You can’t have your cake and eat it too.
proverb,Blood is thicker than water.
proverb,Birds of a feather flock together.
proverb,A friend in need is a friend indeed.
proverb,Absence makes the heart grow fonder.
proverb,Two heads are better than one.
proverb,Keep your friends close and your enemies closer.
proverb,Honesty is the best policy.
proverb,A house divided against itself cannot stand.
proverb,Don’t judge a book by its cover.
proverb,The grass is always greener on the other side.
proverb,A fool and his money are soon parted.
proverb,Knowledge is power.
proverb,Look before you leap.
proverb,A little knowledge is a dangerous thing.
proverb,Curiosity killed the cat.
proverb,Wisdom begins in wonder.
proverb,Experience is the best teacher.
proverb,You can’t teach an old dog new tricks.
proverb,The pen is mightier than the sword.
proverb,Don’t cry over spilled milk.
proverb,You can’t stop the waves; but you can learn to surf.
proverb,Make hay while the sun shines.
proverb,You reap what you sow.
proverb,A tree is known by its fruit.
proverb,Still waters run deep.
proverb,A rolling stone gathers no moss.
proverb,The apple doesn’t fall far from the tree.
proverb,There’s no smoke without fire.
proverb,You can lead a horse to water; but you can’t make it drink.
proverb,April showers bring May flowers.
proverb,Money doesn’t grow on trees.
proverb,Time is money.
proverb,A penny saved is a penny earned.
proverb,The best things in life are free.
proverb,Don’t spend money you don’t have.
proverb,He who buys what he doesn’t need steals from himself.
proverb,Money makes the world go round.
proverb,The rich man’s wealth is his strong city.
proverb,A fool and his money are soon parted.
proverb,It’s better to live rich than to die rich.
proverb,If you want to go fast; go alone. If you want to go far; go together.
proverb,A journey of a thousand miles begins with a single step.
proverb,Fall seven times; stand up eight.
proverb,A man who plants a tree he will never sit under understands the meaning of life.
proverb,Trust; but always verify.
proverb,After the game; the king and the pawn go into the same box.
proverb,Tomorrow is often the busiest day of the week.
proverb,Little by little; the bird makes its nest.
proverb,A good laugh and a long sleep are the two best cures for anything.
proverb,He who has health has hope; and he who has hope has everything.
proverb,Success is the sum of small efforts repeated daily.
proverb,Fortune favors the brave.
proverb,Fail to plan; plan to fail.
proverb,The harder you work; the luckier you get.
proverb,Opportunities don’t happen; you create them.
proverb,Don’t wait for the perfect moment; take the moment and make it perfect.
proverb,Success is a ladder you cannot climb with your hands in your pockets.
proverb,It’s not over until it’s over.
proverb,Winners never quit; and quitters never win.
proverb,Nothing ventured; nothing gained.
proverb,The early bird might get the worm; but the second mouse gets the cheese.
proverb,Don’t put the cart before the horse.
proverb,Even a broken clock is right twice a day.
proverb,You can’t have everything. Where would you put it?
proverb,A watched pot never boils.
proverb,Too many cooks spoil the broth.
proverb,If at first you don’t succeed; try again.
proverb,Barking dogs seldom bite.
proverb,Don’t throw the baby out with the bathwater.
proverb,The squeaky wheel gets the grease.
